{
  "_links": {
    "income": {
      "href": "/individuals/income/?matchId=57072660-1df9-4aeb-b4ea-cd2d7f96e430",
      "name": "GET",
      "title": "View individual's income"
    },
    "employments": {
      "href": "/individuals/employments/?matchId=57072660-1df9-4aeb-b4ea-cd2d7f96e430",
      "name": "GET",
      "title": "View individual's employments"
    },
    "self": {
      "href": "/individuals/matching/57072660-1df9-4aeb-b4ea-cd2d7f96e430"
    }
  },
  "firstName": "Amanda",
  "lastName": "Joseph",
  "nino": "NA000799C",
  "dateOfBirth": "1960-01-15"
}
